{
  "poll_id": "datafolha_2026-09-10_stimulated_1st_round",
  "institute_id": "datafolha",
  "fieldwork_start": "2026-09-08",
  "fieldwork_end": "2026-09-10",
  "fieldwork_mid": "2026-09-09",
  "geography": "national",
  "election_cycle": 2026,
  "scenario": "stimulated_1st_round",
  "sample_size": 2002,
  "moe": 0.02,
  "results": {
    "lula": 0.39,
    "flavio_bolsonaro": 0.35,
    "augusto_cury": 0.06,
    "ronaldo_caiado": 0.04,
    "renan_santos": 0.03,
    "romeu_zema": 0.02,
    "samara_martins": 0.01,
    "edmilson_costa": 0.01,
    "clariana_barao": 0.01,
    "rui_costa_pimenta": 0.01,
    "wilson_grassi": 0.0,
    "hertz_dias": 0.0
  },
  "residuals": {
    "branco_nulo": 0.06,
    "ns_nr": 0.04
  },
  "tse_registration_id": "BR-01833/2026",
  "witness_ids": [
    "w_datafolha_2026-09-10_cnn"
  ],
  "dataset_version": "intake-cohort-002",
  "notes": "CNN Brasil. Principal slate without Marçal (alternate Marçal scenario also published)."
}
