{
  "poll_id": "cnt_mda_2026-08-09_stimulated_2nd_round_lula_vs_renan_santos",
  "institute_id": "cnt_mda",
  "fieldwork_start": "2026-08-05",
  "fieldwork_end": "2026-08-09",
  "fieldwork_mid": "2026-08-07",
  "geography": "national",
  "election_cycle": 2026,
  "sample_size": 2002,
  "moe": 0.022,
  "tse_registration_id": "BR-06935/2026",
  "dataset_version": "intake-cohort-2t-007",
  "scenario": "stimulated_2nd_round_lula_vs_renan_santos",
  "results": {
    "lula": 0.485,
    "renan_santos": 0.33
  },
  "residuals": {
    "branco_nulo": 0.136,
    "ns_nr": 0.049
  },
  "witness_ids": [
    "w_cnt_mda_2026-08-09_pdf_2t"
  ],
  "notes": "Verified from CNT/MDA PDF labeled bars (Branco/Nulo→branco_nulo; Indeciso→ns_nr). Rodada 169."
}
