{
  "poll_id": "vox_brasil_2026-05-12_stimulated_1st_round",
  "institute_id": "vox_brasil",
  "fieldwork_start": "2026-05-09",
  "fieldwork_end": "2026-05-12",
  "sample_size": 2100,
  "moe": 0.0215,
  "results": {
    "flavio_bolsonaro": 0.365,
    "lula": 0.343,
    "ciro_gomes": 0.051,
    "ronaldo_caiado": 0.041,
    "romeu_zema": 0.029,
    "renan_santos": 0.013,
    "augusto_cury": 0.012,
    "cabo_daciolo": 0.004,
    "aldo_rebelo": 0.002
  },
  "residuals": {
    "branco_nulo": 0.055,
    "ns_nr": 0.085
  },
  "tse_registration_id": "BR-02423/2026",
  "notes": "Vox PDF Cenário 1 stimulated. NENHUM/BRANCO/NULO→branco_nulo. confidence=high-pdf.",
  "dataset_version": "intake-cohort-007",
  "witness_ids": [
    "w_vox_brasil_2026-05-12_pdf"
  ],
  "geography": "national",
  "election_cycle": 2026,
  "scenario": "stimulated_1st_round",
  "fieldwork_mid": "2026-05-10"
}
