{
  "poll_id": "poderdata_2026-05-28_stimulated_2nd_round_lula_vs_renan_santos",
  "institute_id": "poderdata",
  "fieldwork_start": "2026-05-25",
  "fieldwork_end": "2026-05-28",
  "fieldwork_mid": "2026-05-26",
  "geography": "national",
  "election_cycle": 2026,
  "sample_size": 2400,
  "moe": 0.02,
  "tse_registration_id": "BR-04882/2026",
  "dataset_version": "intake-cohort-2t-006",
  "scenario": "stimulated_2nd_round_lula_vs_renan_santos",
  "results": {
    "lula": 0.45,
    "renan_santos": 0.36
  },
  "residuals": {
    "branco_nulo": 0.16,
    "ns_nr": 0.03
  },
  "witness_ids": [
    "w_poderdata_2026-05-28_pdf_2t"
  ],
  "notes": "Verified from PoderData/Aya institute PDF; Single-wave PDF pages (Joaquim Barbosa skipped). N/TSE/moe from sibling 1º BR-04882/2026. Scenario stimulated_2nd_round_lula_vs_renan_santos."
}
