{
  "poll_id": "gerp_2026-06-05_stimulated_1st_round",
  "institute_id": "gerp",
  "fieldwork_start": "2026-06-02",
  "fieldwork_end": "2026-06-05",
  "sample_size": 2000,
  "moe": 0.0224,
  "results": {
    "flavio_bolsonaro": 0.35,
    "lula": 0.34,
    "renan_santos": 0.04,
    "romeu_zema": 0.02,
    "ronaldo_caiado": 0.02,
    "joaquim_barbosa": 0.02,
    "augusto_cury": 0.01,
    "cabo_daciolo": 0.0,
    "samara_martins": 0.0,
    "aldo_rebelo": 0.0,
    "rui_costa_pimenta": 0.0,
    "edmilson_costa": 0.0
  },
  "residuals": {
    "branco_nulo": 0.07,
    "ns_nr": 0.12
  },
  "tse_registration_id": "BR-01792/2026",
  "notes": "Gazeta stimulated early-Jun. confidence=press-high.",
  "dataset_version": "intake-cohort-007",
  "witness_ids": [
    "w_gerp_2026-06-05_gazeta"
  ],
  "geography": "national",
  "election_cycle": 2026,
  "scenario": "stimulated_1st_round",
  "fieldwork_mid": "2026-06-03"
}
