{
  "poll_id": "futura_2026-02-07_stimulated_1st_round",
  "institute_id": "futura",
  "fieldwork_start": "2026-02-03",
  "fieldwork_end": "2026-02-07",
  "sample_size": 2000,
  "moe": 0.022,
  "results": {
    "flavio_bolsonaro": 0.372,
    "lula": 0.359,
    "ratinho_junior": 0.061,
    "romeu_zema": 0.049,
    "renan_santos": 0.019,
    "aldo_rebelo": 0.012
  },
  "residuals": {
    "branco_nulo": 0.077,
    "ns_nr": 0.051
  },
  "tse_registration_id": "BR-02276/2026",
  "notes": "Gazeta 100% Cidades/Futura Fev first stimulated. confidence=press-high.",
  "fieldwork_mid": "2026-02-05",
  "geography": "national",
  "election_cycle": 2026,
  "scenario": "stimulated_1st_round",
  "witness_ids": [
    "w_futura_2026-02-07_gazeta"
  ],
  "dataset_version": "intake-cohort-006"
}
