{
  "poll_id": "vox_brasil_2026-06-03_stimulated_1st_round",
  "institute_id": "vox_brasil",
  "fieldwork_start": "2026-06-01",
  "fieldwork_end": "2026-06-03",
  "sample_size": 2100,
  "moe": 0.0215,
  "results": {
    "lula": 0.421,
    "flavio_bolsonaro": 0.336,
    "ronaldo_caiado": 0.069,
    "renan_santos": 0.031,
    "romeu_zema": 0.051,
    "aecio_neves": 0.021,
    "joaquim_barbosa": 0.011,
    "augusto_cury": 0.005,
    "cabo_daciolo": 0.003
  },
  "residuals": {
    "branco_nulo": 0.029,
    "ns_nr": 0.023
  },
  "tse_registration_id": "BR-08016/2026",
  "notes": "Series table col 5 JUNHO 2026 in Aug Vox PDF. Fieldwork 1–3 Jun per TSE/old lead BR-08016; pub ~5 Jun. confidence=high-pdf-series.",
  "dataset_version": "intake-cohort-007",
  "witness_ids": [
    "w_vox_brasil_2026-06-03_pdf_series"
  ],
  "geography": "national",
  "election_cycle": 2026,
  "scenario": "stimulated_1st_round",
  "fieldwork_mid": "2026-06-02"
}
