{
  "poll_id": "palver_2026-10-20_stimulated_2nd_round_flavio_bolsonaro_vs_lula",
  "institute_id": "palver",
  "fieldwork_start": "2026-10-18",
  "fieldwork_end": "2026-10-20",
  "fieldwork_mid": "2026-10-19",
  "geography": "national",
  "election_cycle": 2026,
  "scenario": "stimulated_2nd_round_flavio_bolsonaro_vs_lula",
  "sample_size": 5000,
  "moe": 0.024,
  "results": {
    "flavio_bolsonaro": 0.5,
    "lula": 0.48
  },
  "residuals": {
    "branco_nulo": 0.01,
    "ns_nr": 0
  },
  "tse_registration_id": "BR-04612/2026",
  "witness_ids": [
    "w_palver_2026-10-20_stimulated_2nd_round_flavio_bolsonaro_vs_lula_uol"
  ],
  "dataset_version": "intake-cohort-009",
  "notes": "Total-vote shares transcribed from press report. Fieldwork 2026-10-18 to 2026-10-20; after first-round voting on 2026-10-04. Valid-vote shares are not used in this record."
}
